{
  "id": "run-001",
  "project_id": "project-agent-evolution",
  "status": "pending",
  "plan": {
    "question": "Agent 自进化有哪些主要技术路线？",
    "include_terms": ["self-evolving agents", "self-improving agents"],
    "exclude_terms": [],
    "languages": ["zh", "en"],
    "source_kinds": ["arxiv", "github", "rss", "manual_url"],
    "start_date": "2026-09-22",
    "end_date": "2026-10-22",
    "seed_urls": []
  },
  "workflow_version": "1.0.0",
  "created_at": "2026-10-22T10:00:00+08:00",
  "updated_at": "2026-10-22T10:00:00+08:00",
  "checkpoint": null
}

